{
  "$schema": "https://json-schema.org/draft/2020-12/schema",
  "type": "object",
  "required": [
    "name",
    "nameJa",
    "slug",
    "version",
    "build"
  ],
  "properties": {
    "name": {
      "type": "string",
      "minLength": 1
    },
    "nameJa": {
      "type": "string",
      "minLength": 1
    },
    "slug": {
      "type": "string",
      "pattern": "^[a-z0-9][a-z0-9-]*$"
    },
    "version": {
      "type": "string",
      "minLength": 1
    },
    "description": {
      "type": "string"
    },
    "descriptionJa": {
      "type": "string"
    },
    "defaultLanguage": {
      "type": "string"
    },
    "repository": {
      "type": "object"
    },
    "build": {
      "type": "object",
      "required": [
        "output",
        "blockRuntimeNetwork"
      ],
      "properties": {
        "output": {
          "type": "string"
        },
        "blockRuntimeNetwork": {
          "type": "boolean"
        },
        "selfExtract": {
          "type": "object"
        }
      }
    }
  }
}
